,index,Rank,NCT Number,Title,Acronym,Status,Study Results,Conditions,Interventions,Outcome Measures,Sponsor/Collaborators,Gender,Age,Phases,Enrollment,Funded Bys,Study Type,Study Designs,Other IDs,Start Date,Primary Completion Date,Completion Date,First Posted,Results First Posted,Last Update Posted,Locations,Study Documents,URL,arms,arm1,arm2,arm1_included,arm2_included,arm1_to_remove,arm2_to_remove,also_arm1_to_remove,also_arm2_to_remove,new_arm1,new_arm2,arm1_has_approved_drugs,arm2_has_approved_drugs,Included,Reason
650,2857,2858,NCT03596866,An Efficacy Study Comparing Brigatinib Versus Alectinib in Advanced Anaplastic Lymphoma Kinase-Positive (ALK+) Non-Small-Cell Lung Cancer (NSCLC) Participants Who Have Progressed on Crizotinib,ALTA-3,Recruiting,No Results Available,ALK+ Advanced NSCLC,Drug: Brigatinib|Drug: Alectinib,PFS as Assessed by Blinded Independent Review Committee (BIRC) per RECIST v1.1|Time to Intracranial Progression (iPD) as Assessed by BIRC per Modified RECIST v1.1|Overall Survival (OS)|Objective Response Rate (ORR) as Assessed by Investigator and BIRC per RECIST v1.1|Time to Response as Assessed by Investigator and BIRC|Duration of Response (DOR) as Assessed by BIRC|Intracranial Objective Response Rate (iORR) as Assessed by BIRC per Modified RECIST v1.1|Intracranial Duration of Response (iDOR) as Assessed by the BIRC per Modified RECIST v1.1|Health-Related Quality of Life (HRQOL) from European Organization for Research and Treatment of Cancer Quality of Life Questionnaire (EORTC QLQ-C30 v3.0) Score|HRQOL from EORTC QLQ- Lung Cancer (LC) 13,Ariad Pharmaceuticals|Takeda,All,"18 Years and older   (Adult, Older Adult)",Phase 3,246,Industry,Interventional,Allocation: Randomized|Intervention Model: Parallel Assignment|Masking: None (Open Label)|Primary Purpose: Treatment,Brigatinib-3001|2018-001957-29,19-Apr-19,4-Dec-21,5-Dec-22,24-Jul-18,,25-Oct-19,"The Oncology Institute of Hope and Innovation, Whittier, California, United States|University Cancer and Blood Center, Athens, Georgia, United States|Virginia Cancer Specialists, Fairfax, Virginia, United States|Centro Para la Atencion Integral del Paciente Oncologico, San Miguel De Tucuman, Tucuman, Argentina|Sanatorio Duarte Quiros, Cordoba, Argentina|Instituto Alexander Fleming, Cuidad Autonoma de Buenos Aires, Argentina|Centro Oncologico Riojano Integral, La Rioja, Argentina|Klinikum Klagenfurt Am Worthersee, Klagenfurt Am Woerthersee, Carinthia, Austria|Allgemeines Krankenhaus der Stadt Wien, Wien, Vienna, Austria|Queen Elizabeth II Health Sciences Centre, Halifax, Nova Scotia, Canada|Toronto University Health Network, Toronto, Ontario, Canada|Red Hospital Clinico de La Universidad de Chile, Santiago, Region Metropolitana, Chile|Centro de Investigacion Clinica Bradford Hill, Recoleta, Santiago, Chile|Beijing Chest Hospital, Beijing, Beijing, China|Peking Union Medical College Hospital - East, Beijing, Beijing, China|The 307th Hospital of Chinese Peoples Liberation Army, Beijing, Beijing, China|Beijing Cancer Hospital, Beijing, Beijing, China|Peking University Cancer Hospital/Beijing Cancer Hospital, Hai-Dian, Beijing, China|The First Affiliated Hospital of Guangzhou Medical University, Guangzhou, Guangdong, China|Affiliated Tumor Hospital of Harbin Medical University - The 3rd Affiliated Hospital of HMU, Harbin, Heilongjiang, China|Henan Cancer Hospital, Zhengzhou, Henan, China|Jilin Provincial Cancer Hospital (Changchun Cancer Hospital), Changchun, Jilin, China|The First Hospital of Jilin University, Changchun, Jilin, China|Shanghai Chest Hospital, Shanghai, Shanghai, China|Fudan University Shanghai Cancer Center, Shanghai, Shanghai, China|Tianjin Medical University Cancer Institute & Hospital, Tianjin, Tianjin, China|Zhejiang Cancer Hospital, Hangzhou, Zhejiang, China|The First Affiliated Hospital, Zhejiang University, Hangzhou, Zhejiang, China|Opca bolnica Dubrovnik, Dubrovnik, Dubrovnik-Neretva, Croatia|General Hospital Pula, Pula, Croatia|Klinicki bolnicki centar Sestre milosrdnice, Zagreb, Croatia|Klinika za Pulmologiju, Zagreb, Croatia|Hopital Haut-Leveque, Pessac, Aquitaine, France|Centre Hospitalier Intercommunal de Creteil, Creteil, Ile-de-france, France|Hopital Foch, Suresnes, Ile-de-france, France|Gustave Roussy, Villejuif cedex, Ile-de-france, France|Centre Hospitalier Universitaire de Toulouse- Hopital Larrey, Toulouse Cedex 9, Midi-pyrenees, France|Centre Hospitalier Le Mans, Le Mans Cedex 9, PAYS DE LA Loire, France|Centre Hospitalier Intercommunal Toulon - La Seyne Sur Mer, Toulon, Provence Alpes COTE D'azur, France|Hopital Albert Michallon, Grenoble Cedex 9, Rhone-alpes, France|Thoraxklinik Heidelberg, Heidelberg, Baden-wuerttemberg, Germany|Asklepios Fachkliniken Munchen-Gauting, Gauting, Bayern, Germany|Klinikum Kempten-Oberallgau, Immenstadt, Bayern, Germany|Sotiria General Hospital for Respiratory Diseases of Attica, Mesogeion, Athens, Greece|University General Hospital of Athens Attikon, Athens, Attica, Greece|Iaso General Hospital, Cholargos, Attica, Greece|General Oncology Hospital of Kifisia Oi Agioi Anargiroi, Nea Kifisia, Attica, Greece|Interbalkan Medical Center of Thessaloniki, Thessaloniki, Macedonia, Greece|University General Hospital of Larissa, Larissa, Thessaly, Greece|Pamela Youde Nethersole Eastern Hospital, Chai Wan, Eastern District, Hong Kong|Humanity and Health Research Centre, Central, Hong Kong|Queen Mary Hospital, Hong Kong, Hong Kong|Queen Mary Hospital, Hong Kong, Hong Kong|Hong Kong United Oncology Centre, Kowloon, Hong Kong|Princess Margaret Hospital, Kowloon, Hong Kong|Istituto Scientifico Romagnolo per lo Studio e la Cura dei Tumori, Meldola, Forli-cesena, Italy|Centro di Riferimento Oncologico di Aviano, Aviano, Pordenone, Italy|Azienda Ospedaliero Universitaria di Bologna Policlinico Sant'Orsola-Malpighi, Bologna, Italy|Azienda Ospedaliera Universitaria San Martino, Genova, Italy|Istituto Scientifico Universitario San Raffaele, Milano, Italy|Istituto Nazionale Tumori IRCCS Fondazione Pascale, Napoli, Italy|Ospedale Santa Maria delle Croci, Ravenna, Italy|Chungbuk National University Hospital, Cheongju-si, Chungcheongbuk-do, Korea, Republic of|National Cancer Center, Goyang-si, Gyeonggi-do, Korea, Republic of|Gachon University Gil Medical Center, Incheon, Gyeonggi-do, Korea, Republic of|The Catholic University of Korea St. Vincent's Hospital, Suwon-si, Gyeonggi-do, Korea, Republic of|Ajou University Hospital, Suwon, Gyeonggi-do, Korea, Republic of|Ulsan University Hospital, Ulsan, Gyeongsangnam-do, Korea, Republic of|Korea University Anam Hospital, Seoul, Korea, Republic of|Seoul National University Hospital, Seoul, Korea, Republic of|Samsung Medical Center, Seoul, Korea, Republic of|The Catholic University of Korea - Seoul St. Mary's Hospital, Seoul, Korea, Republic of|Medica Sur, Ciudad de Mexico, Cdmx, Mexico|Centro de Investigacion Medica Aguascalientes, Aguascalientes, Mexico|Institutul Oncologic Prof. Dr. Ion Chiricu, Cluj-Napoca, Cluj, Romania|Oncocenter- Oncologie Clinic, Timioara, Timis, Romania|Institutul Oncologic Prof. Dr. Alexandru Trestioreanu Bucaresti, Bucuresti, Romania|Centrul de oncologie Euroclinic, Iasi, Romania|Euromedservice, Saint-Petersburg, Saint Petersburg, Russian Federation|Saint Petersburg Clinical Scientific and Practical Center of Specialized Types of Medical Aid, Saint-Petersburg, Saint Petersburg, Russian Federation|N.N. Blokhin Russian Cancer Research Center, Moscow, Russian Federation|VitaMed, Moscow, Russian Federation|State Budget Institution National Medical Research Center of Radiology of the Ministry of Heal, Moscow, Russian Federation|Moscow City Oncology Hospital Number 62, Moscow, Russian Federation|Leningrad Regional Clinical Hospital, Saint Petersburg, Russian Federation|Center of Palliative Medicine - Devita, Saint Petersburg, Russian Federation|Hospital Universitari Germans Trias i Pujol, Badalona, Barcelona, Spain|Hospital Teresa Herrera - Materno Infantil, A Coruna, LA Coruna, Spain|Hospital Universitari Vall d'Hebron, Barcelona, Spain|Hospital Clinic i Provincial de Barcelona, Barcelona, Spain|Hospital General Universitario Gregorio Maranon, Madrid, Spain|Hospital Universitario Ramon Y Cajal, Madrid, Spain|Hospital Clinico San Carlos, Madrid, Spain|Hospital Universitario 12 de Octubre, Madrid, Spain|Hospital Universitario La Paz, Madrid, Spain|Hospital Regional Universitario de Malaga, Malaga, Spain|Karolinska Universitetssjukhuset - Solna, Solna, Stockholm, Sweden|Uppsala Akademiska Sjukhus, Uppsala, Sweden|Changhua Christian Hospital, Changhua City, Taiwan|Hualien Tzu Chi Hospital, Hualien, Taiwan|Kaohsiung Medical University Hospital, Kaohsiung, Taiwan|Chi Mei Hospital Liouying, Tainan City, Taiwan|National Cheng Kung University Hospital, Tainan, Taiwan|National Taiwan University Hospital, Taipei, Taiwan|Chang Gung Memorial Hospital Linkou Branch, Taoyuan City, Taiwan|Phramongkutklao Hospital, Bangkok, Bangkok Metropolis, Thailand|King Chulalongkorn Memorial Hospital, Bangkok, Thailand|Songklanagarind Hospital, Songkhla, Thailand",,https://ClinicalTrials.gov/show/NCT03596866,2,brigatinib,alectinib,1,1,FALSE,FALSE,FALSE,FALSE,brigatinib,alectinib,1,1,TRUE,
653,2865,2866,NCT03302247,Depletion of Myeloid Derived Suppressor Cells to Enhance Anti PD-1 Therapy,,Terminated,No Results Available,Non Small Cell Lung Cancer Stage IIIB,Biological: Nivolumab|Drug: Nivolumab+Gemcitabine,Evaluate depletion of MDSC in numbers as a result of treatment with gemcitabine.|Evaluate whether these measures result in enhanced T-cell activity|Evaluate whether these measures result in enhanced NK cell function|Determine the tolerability and clinical activity (including response rate and survival) of this approach|Correlate MDSC number with tumor PD-L1 expression,Fox Chase Cancer Center,All,"18 Years and older   (Adult, Older Adult)",Phase 2,3,Other,Interventional,Intervention Model: Single Group Assignment|Masking: None (Open Label)|Primary Purpose: Treatment,TH-113,15-Jan-18,21-Mar-19,12-Jul-19,5-Oct-17,,25-Jul-19,"Fox Chase Cancer Center - Philadelphia, Philadelphia, Pennsylvania, United States",,https://ClinicalTrials.gov/show/NCT03302247,2,nivolumab,nivolumab+gemcitabine,1,1,FALSE,FALSE,FALSE,FALSE,nivolumab,nivolumab+gemcitabine,1,1,TRUE,
655,2869,2870,NCT00754364,Mono Versus Polichemotherapy in Non Small Cell Lung Cancer (NSCLC) Elderly Patients,,Terminated,No Results Available,NSCLC,Drug: Pemetrexed/Carboplatin|Drug: Gemcitabine,"Evaluate Progression Free Survival of Carboplatin plus Alimta vs gemcitabine in chemonaive, elderly stage IIIB-IV NSCLC patients.|Overall Survival Quality of life","Armando Santoro, MD|Istituto Clinico Humanitas",All,70 Years and older   (Older Adult),Phase 2,108,Other,Interventional,Allocation: Randomized|Intervention Model: Parallel Assignment|Masking: None (Open Label)|Primary Purpose: Treatment,ONC-2007-003,8-Oct,14-May,15-Dec,18-Sep-08,,29-Jan-14,"Istituto Clinco Humanitas, Rozzano, Milan, Italy",,https://ClinicalTrials.gov/show/NCT00754364,2,pemetrexed/carboplatin,gemcitabine,1,1,FALSE,FALSE,FALSE,FALSE,pemetrexed/carboplatin,gemcitabine,1,1,TRUE,
667,2906,2907,NCT02595840,Biomarker Study Accompanying the AIO-TRK-0114 Study (MARBLE),Trans-MARBLE,Terminated,No Results Available,Non-small-cell Lung Cancer With Somatic EGFR Mutations,Drug: Afatinib|Drug: Pemetrexed,Progression-free Survival in relation to exploratory biomarkers|Overall Survival in relation to exploratory biomarkers|Objective response rate,Universität Duisburg-Essen,All,"18 Years and older   (Adult, Older Adult)",Phase 2,4,Other,Interventional,Allocation: Randomized|Intervention Model: Parallel Assignment|Masking: None (Open Label)|Primary Purpose: Treatment,EudraCT-Nr. 2014-001983-36,25-Nov-15,20-Nov-17,20-Nov-17,4-Nov-15,,19-Apr-19,,,https://ClinicalTrials.gov/show/NCT02595840,2,afatinib,pemetrexed,1,1,FALSE,FALSE,FALSE,FALSE,afatinib,pemetrexed,1,1,TRUE,
670,2916,2917,NCT00280735,Ph II Adjuvant Carboplatin/Docetaxel in Curatively Resected Stage I-IIIA NSCLC,,Completed,Has Results,Lung Cancer,Drug: carboplatin|Drug: docetaxel,Number of Participants Who Completed Four Cycles of the Carboplatin/Docetaxel Regimen|Patterns of Recurrence in Patients Treated With This Regimen|Toxicity in Patients Treated With This Regimen|Progression Free Survival|Overall Survival,UNC Lineberger Comprehensive Cancer Center|Aventis Pharmaceuticals,All,"18 Years to 120 Years   (Adult, Older Adult)",Phase 2,75,Other|Industry,Interventional,Intervention Model: Single Group Assignment|Masking: None (Open Label)|Primary Purpose: Treatment,LCCC 0320,4-May,11-Jul,11-Jul,23-Jan-06,12-Jun-17,11-Jul-17,"University of North Carolina Lineberger Comprehensive Cancer Center, Chapel Hill, North Carolina, United States",,https://ClinicalTrials.gov/show/NCT00280735,2,carboplatin,docetaxel,1,1,FALSE,FALSE,FALSE,FALSE,carboplatin,docetaxel,1,1,TRUE,
671,2931,2932,NCT03810872,"An Explorative Study of Afatinib in the Treatment of Advanced Cancer Carrying an EGFR, a HER2 or a HER3 Mutation",,Recruiting,No Results Available,"Cancers Harbouring an EGFR Mutation, (Excluding Non-squamous Non- Small Cell Lung Cancer, a Registered Indication), a HER2 Mutation or a HER3 Mutation",Drug: Afatinib|Drug: Paclitaxel,Response rate|Incidence and intensity of adverse events|Disease control rate|Progression free survival|Overall survival,AZ-VUB,All,"18 Years and older   (Adult, Older Adult)",Phase 2,87,Other,Interventional,Intervention Model: Single Group Assignment|Masking: None (Open Label)|Primary Purpose: Treatment,Precision 2 - 1200.264,21-Jun-17,20-Dec,22-Dec,21-Jan-19,,21-Jan-19,"Institut Jules Bordet, Brussels, Belgium|Les Cliniques Universitaires St Luc, Brussels, Belgium|Universitaire Ziekenhuis Antwerpen, Edegem, Belgium|UZ Gent, Gent, Belgium|CHU Sart-Tilman, Liège, Belgium",,https://ClinicalTrials.gov/show/NCT03810872,2,afatinib,paclitaxel,1,1,FALSE,FALSE,FALSE,FALSE,afatinib,paclitaxel,1,1,TRUE,
673,2943,2944,NCT00256711,Phase II Iressa Versus Vinorelbine (INVITE),,Completed,No Results Available,Non-Small-Cell Lung Carcinoma,Drug: Gefitinib|Drug: Vinorelbine,To compare ZD1839 and vinorelbine in terms of progression free survival|To compare ZD1839 and vinorelbine in terms of pulmonary symptom improvement weekly for 18 weeks.|To compare ZD1839 and vinorelbine in terms of quality of life 3 weekly for 18 weeks then 6 weekly.|To compare ZD1839 and vinorelbine in terms of adverse event profile continuous monitoring.|To compare ZD1839 and vinorelbine in terms of overall objective tumour response rate (complete response and partial response) 6 weekly to progression.|To compare ZD1839 and vinorelbine in terms of overall survival (time to death) continuous monitoring,AstraZeneca,All,70 Years and older   (Older Adult),Phase 2,192,Industry,Interventional,Allocation: Randomized|Intervention Model: Parallel Assignment|Masking: None (Open Label)|Primary Purpose: Treatment,D791AC00001|INVITE,4-Jul,,6-Feb,22-Nov-05,,23-Apr-09,"Research Site, St. Leonards, New South Wales, Australia|Research Site, Westmead, New South Wales, Australia|Research Site, South Brisbane, Queensland, Australia|Research Site, Nedlands, Western Australia, Australia|Research Site, Victoria, Australia|Research Site, Fortaleza, CE, Brazil|Research Site, Goiania, GO, Brazil|Research Site, Rio de Janeiro, RJ, Brazil|Research Site, Sao Paulo, SP, Brazil|Research Site, Praha 8, CZ, Czech Republic|Research Site, Usti nad Labem, CZ, Czech Republic|Research Site, Hradec Kralove, Czech Republic|Research Site, Kutná Hora, Czech Republic|Research Site, Olomouc, Czech Republic|Research Site, Ostrava - Poruba, Czech Republic|Research Site, Ostrava, Czech Republic|Research Site, Plzen, Czech Republic|Research Site, Marseille Cedex 09, France|Research Site, Montpellier Cedex 5, France|Research Site, Montpellier Cedex, France|Research Site, Pierre Benite Cedex, France|Research Site, Vesoul Cedex, France|Research Site, Heidelberg, Baden-Württemberg, Germany|Research Site, Ulm, Baden-Württemberg, Germany|Research Site, München, Bayern, Germany|Research Site, Magdeburg, Sachsen-Anhalt, Germany|Research Site, Bad Segeberg, Schleswig-Holstein, Germany|Research Site, Berlin, Germany|Research Site, Großhansdorf, Germany|Research Site, Halle, Germany|Research Site, Hamburg, Germany|Research Site, Mainz, Germany|Research Site, La Torretta, Ancona, Italy|Research Site, Bergamo, BG, Italy|Research Site, Bologna, BO, Italy|Research Site, Catania, CT, Italy|Research Site, Melegnano, MI, Italy|Research Site, Milano, MI, Italy|Research Site, Rozzano, MI, Italy|Research Site, Modena, MO, Italy|Research Site, Parma, PR, Italy|Research Site, Orbassano, TO, Italy|Research Site, Torino, TO, Italy|Research Site, Napoli, Italy|Research Site, Seoul, Korea, Republic of|Research Site, Cape Town, South Africa|Research Site, Durban, South Africa|Research Site, Taichung, Taiwan|Research Site, Taipei, Taiwan|Research Site, Cambridge, Cambrideshire, United Kingdom|Research Site, Birmingham, West Midlands, United Kingdom|Research Site, Aberdeen, United Kingdom|Research Site, Dundee, United Kingdom|Research Site, Glasgow, United Kingdom|Research Site, Nottingham, United Kingdom|Research Site, Sheffield, United Kingdom",,https://ClinicalTrials.gov/show/NCT00256711,2,gefitinib,vinorelbine,1,1,FALSE,FALSE,FALSE,FALSE,gefitinib,vinorelbine,1,1,TRUE,
