,index,Rank,NCT Number,Title,Acronym,Status,Study Results,Conditions,Interventions,Outcome Measures,Sponsor/Collaborators,Gender,Age,Phases,Enrollment,Funded Bys,Study Type,Study Designs,Other IDs,Start Date,Primary Completion Date,Completion Date,First Posted,Results First Posted,Last Update Posted,Locations,Study Documents,URL,arms,arm1,arm2,arm1_included,arm2_included,arm1_to_remove,arm2_to_remove,also_arm1_to_remove,also_arm2_to_remove,new_arm1,new_arm2,arm1_has_approved_drugs,arm2_has_approved_drugs,Included,Reason
452,1980,1981,NCT00284778,Pharmaco-economic Study of a Second Line Treatment in Advanced Non Small Cell Lung Cancer,,Completed,No Results Available,"Carcinoma, Non-Small-Cell Lung",Drug: Alimta®|Drug: Taxotere®,,"University Hospital, Limoges|Groupe Francais De Pneumo-Cancerologie",All,"18 Years to 70 Years   (Adult, Older Adult)",Phase 3,150,Other,Interventional,Allocation: Randomized|Intervention Model: Parallel Assignment|Masking: None (Open Label)|Primary Purpose: Treatment,I05026,6-Feb,9-Dec,9-Dec,1-Feb-06,,29-Mar-10,"Service de Pneumologie, CHU Angers, Angers, France|Service de pneumologie; Centre Hospitalier d'Annecy, Annecy, France|Service de Pneumologie; Centre Hospitalier, Beauvais, France|Service de Pneumologie ; Centre hospitalier, Charleville-Mezieres, France|Service de Pneumologie; Centre Hospitalier, Draguignan, France|Service de Pathologie Respiratoire; CHU de Limoges, Limoges, France|Service de Pneumologie; Hôpital de la Croix Rousse, Lyon, France|Service de Pneumologie-Neurologie ; Centre Hospitalier F. Quesnay, Mantes La Jolie, France|Département des Maladies Respiratoires ; Hôpital Sainte Marguerite, Marseille, France|Service de Pneumologie et Réanimation ; Hôpital Hôtel Dieu - Paris, Paris, France|Service de Pneumologie - Hôpital St Antoine, Paris, Paris, France|Service de Pneumologie ; Hôpital saint Antoine, Paris, Paris, France|Service de Pneumologie-Allergologie; Centre Hospitalier Général, Perigueux, France|Service de Pneumologie; CHG de Roanne, Roanne, France|Clinique Pneumologique; Hôpital Charles Nicolle, Rouen, France|Service de Pneumologie; Hôpital Bois Guillaume, Rouen, France|Service de Pathologie Respiratoire; Hôpital d'Instruction des Armées Sainte-Anne, Toulon Naval, France|Service d'Oncologie Médicale; Clinique Sainte Marguerite, Toulon, France",,https://ClinicalTrials.gov/show/NCT00284778,2,alimta®,taxotere®,1,1,FALSE,FALSE,FALSE,FALSE,alimta®,taxotere®,1,1,TRUE,
455,1995,1996,NCT01955421,Erlotinib 100mg qd Versus Gefitinib 250mg qd for EGFR Mutant Nsclc,NSCLC EGFR TKI,Unknown status,No Results Available,Advanced Stage Non Small Cell Lung Cancer,Drug: Erlotinib 100mg qd|Drug: Gefitinib 250mg qd,disease control rate|progression free survival|adverse events,Sun Yat-sen University,All,"18 Years and older   (Adult, Older Adult)",Phase 2,224,Other,Interventional,Allocation: Randomized|Intervention Model: Parallel Assignment|Masking: None (Open Label)|Primary Purpose: Treatment,E100VG250|Tarceva100vsIressa250,13-Jul,16-Jun,,7-Oct-13,,3-Jul-15,"Department of Medical Oncology, Cancer Center of Sun Yat-Sen University, Guangzhou, Guangdong, China",,https://ClinicalTrials.gov/show/NCT01955421,2,erlotinib 100mg qd,gefitinib 250mg qd,1,1,FALSE,FALSE,FALSE,FALSE,erlotinib,gefitinib,1,1,TRUE,
459,2006,2007,NCT00076388,Iressa Versus Docetaxel (Taxotere),,Completed,No Results Available,Non-Small-Cell Lung Carcinoma,Drug: Gefitinib|Drug: Docetaxel,To compare overall survival between ZD1839 and docetaxel|To compare time to progression (TTP) between ZD1839 and docetaxel|To compare progression-free rates at 4 months and 6 months between ZD1839 and docetaxel|To compare the overall objective tumor response rate between ZD1839 and docetaxel|To compare patient-reported functionality (PRF) and quality of life (QoL) between ZD1839 and docetaxel|To compare safety and tolerability of ZD1839 and docetaxel,AstraZeneca,All,"18 Years and older   (Adult, Older Adult)",Phase 3,1440,Industry,Interventional,Allocation: Randomized|Intervention Model: Parallel Assignment|Masking: None (Open Label)|Primary Purpose: Treatment,D791GC00001|EudraCT No: 2004-002943-28|1839IL/0721,4-Feb,7-Mar,7-Oct,23-Jan-04,,13-May-11,"Research Site, Birmingham, Alabama, United States|Research Site, Fountain Valley, California, United States|Research Site, Los Angeles, California, United States|Research Site, Santa Rosa, California, United States|Research Site, Stockton, California, United States|Research Site, Colorado Springs, Colorado, United States|Research Site, Norwich, Connecticut, United States|Research Site, Newark, Delaware, United States|Research Site, Boca Raton, Florida, United States|Research Site, Orlando, Florida, United States|Research Site, Macon, Georgia, United States|Research Site, Tucker, Georgia, United States|Research Site, Skokie, Illinois, United States|Research Site, Knoxville, Kentucky, United States|Research Site, St. Louis Park, Minnesota, United States|Research Site, Great Neck, New York, United States|Research Site, Rochester, New York, United States|Research Site, Syracuse, New York, United States|Research Site, Chapel Hill, North Carolina, United States|Research Site, Charlotte, North Carolina, United States|Research Site, Durham, North Carolina, United States|Research Site, Cleveland, Ohio, United States|Research Site, Portland, Oregon, United States|Research Site, Philadelphia, Pennsylvania, United States|Research Site, Pittsburgh, Pennsylvania, United States|Research Site, Columbia, South Carolina, United States|Research Site, Nashville, Tennessee, United States|Research Site, Austin, Texas, United States|Research Site, Dallas, Texas, United States|Research Site, Houston, Texas, United States|Research Site, Tyler, Texas, United States|Research Site, Salt Lake City, Utah, United States|Research Site, Fairfax, Virginia, United States|Research Site, Seattle, Washington, United States|Research Site, Racine, Wisconsin, United States|Research Site, Buenos Aires, Argentina|Research Site, Cordoba, Argentina|Research site, El Palomar, Argentina|Research Site, Mar del Plata, Argentina|Research Site, Quilmes, Argentina|Research Site, Rosario, Argentina|Research Site, San Miguel de Tucuman, Argentina|Research Site, Santa Fe, Argentina|Research Site, Charleroi, Belgium|Research Site, Edegem, Belgium|Research Site, Genk, Belgium|Research Site, Godinne, Belgium|Research Site, Kortrijk, Belgium|Research Site, Leuven, Belgium|Research Site, Liège, Belgium|Research Site, Yvoir, Belgium|Research Site, Rio de Janeiro, RJ, Brazil|Research Site, Porto Alegre, RS, Brazil|Research Site, Sao Paulo, SP, Brazil|Research Site, Edmonton, Alberta, Canada|Research Site, Surrey, British Columbia, Canada|Research Site, Moncton, New Brunswick, Canada|Research Site, Halifax, Nova Scotia, Canada|Research Site, Hamilton, Ontario, Canada|Research Site, London, Ontario, Canada|Research Site, Newmarket, Ontario, Canada|Research Site, St. Catherines, Ontario, Canada|Research Site, Sudbury, Ontario, Canada|Research Site, Toronto, Ontario, Canada|Research Site, York, Ontario, Canada|Research Site, Laval, Quebec, Canada|Research Site, Montreal, Quebec, Canada|Research Site, Ste-Foy, Quebec, Canada|Research Site, Beijing, China|Research Site, Guangzhou, China|Research Site, Shanghai, China|Research Site, Split, Croatia|Research Site, Zagreb, Croatia|Research Site, Aalborg, Denmark|Research Site, Arhus C, Denmark|Research Site, Glostrup, Denmark|Research Site, Herlev, Denmark|Research Site, København Ø, Denmark|Research Site, Vejle, Denmark|Research Site, Tallinn, Estonia|Research Site, Tartu, Estonia|Research Site, Blois, France|Research Site, Boulogne Billancourt, France|Research Site, Caen Cedex, France|Research Site, Grenoble Cedex 09, France|Research Site, Le Mans, France|Research Site, Lille Cedex, France|Research Site, Nantes, France|Research Site, Niort, France|Research Site, Saint Herblain, France|Research Site, Vandoeuvre Les Nancy, France|Research Site, Vesoul Cedex, France|Research Site, Heidelberg, Baden-Württemberg, Germany|Research Site, Ulm, Baden-Württemberg, Germany|Research Site, Cottbus, Brandenburg, Germany|Research Site, Frankfurt, Hessen, Germany|Research Site, Düsseldorf, Nordrhein-Westfalen, Germany|Research Site, Mainz, Rheinland-Pfalz, Germany|Research Site, Bad Segeberg, Schleswig-Holstein, Germany|Research Site, Berlin, Germany|Research Site, Bonn, Germany|Research Site, Großhansdorf, Germany|Research Site, Köln, Germany|Research Site, Leverkusen, Germany|Research Site, Löwenstein, Germany|Research Site, Mannheim, Germany|Research Site, München, Germany|Research Site, Stuttgart, Germany|Research Site, Wiesbaden, Germany|Research Site, Hong Kong, Hong Kong|Research Site, Jakarta, Indonesia|Research Site, Yogyakarta, Indonesia|Research Site, La Torretta, Ancona, Italy|Research Site, Bari, BA, Italy|Research Site, Bergamo, BG, Italy|Research Site, Bologna, BO, Italy|Research Site, Cuneo, CN, Italy|Research Site, Catania, CT, Italy|Research Site, Forli', FO, Italy|Research Site, Melegnano, MI, Italy|Research Site, Rozzano, MI, Italy|Research Site, Modena, MO, Italy|Research Site, Parma, PR, Italy|Research Site, Torino, TO, Italy|Research Site, Napoli, Italy|Research Site, Roma, Italy|Research Site, Riga, Latvia|Research Site, Kuala Lumpur, Malaysia|Research Site, Nilai, Malaysia|Research Site, Guadalajara, Mexico|Research Site, Monterrey, Mexico|Research Site, Morelia, Mexico|Research Site, Torreon, Mexico|Research Site, Manila, Philippines|Research Site, Quezon City, Philippines|Research Site, Singapore, Singapore|Research Site, Ljubliana, Slovenia|Research Site, Elche, Alicante, Spain|Research Site, Barcelona, Spain|Research Site, Gerona, Spain|Research Site, Madrid, Spain|Research Site, Málaga, Spain|Research Site, Sevilla, Spain|Research Site, Valencia, Spain|Research Site, Vitoria, Spain|Research Site, Zaragoza, Spain|Research Site, Goteborg, Sweden|Research Site, Luleå, Sweden|Research Site, Skövde, Sweden|Research Site, Stockholm, Sweden|Research Site, Sundsvall, Sweden|Research Site, Umeå, Sweden|Research Site, Vasteras, Sweden|Research Site, Örebro, Sweden|Research Site, Östersund, Sweden|Research Site, Bellinzona, Switzerland|Research Site, St. Gallen, Switzerland|Research Site, Zürich, Switzerland|Research Site, Chiang Mai, Thailand|Research Site, Ankara, Turkey|Research Site, Istanbul, Turkey|Research Site, Izmir, Turkey",,https://ClinicalTrials.gov/show/NCT00076388,2,gefitinib,docetaxel,1,1,FALSE,FALSE,FALSE,FALSE,gefitinib,docetaxel,1,1,TRUE,
460,2015,2016,NCT01673867,Study of BMS-936558 (Nivolumab) Compared to Docetaxel in Previously Treated Metastatic Non-squamous NSCLC,CheckMate057,"Active, not recruiting",Has Results,Non-Squamous Cell Non-small Cell Lung Cancer,Biological: Nivolumab|Drug: Docetaxel,Overall Survival (OS) Time in Months for All Randomized Participants at Primary Endpoint|One-year Overall Survival (OS) Rate in All Randomized Participants|Number of Deaths From Any Cause in All Randomized Participants at Primary Endpoint|Objective Response Rate (ORR) in All Randomized Participants at Primary Endpoint|Duration of Objective Response (DOR) in Months for All Confirmed Responders at Primary Endpoint|Time To Response (TTR) in Months for All Confirmed Responders at Primary Endpoint|Progression-Free Survival (PFS) Rate at 12 Months|Progression-Free Survival (PFS) Time in Months for All Randomized Participants at Primary Endpoint|Percentage of Participants Experiencing Disease-related Symptom Improvement by Week 12|Overall Survival (OS) Time in Months by Baseline PD-L1 Expression for All Randomized Participants at Primary Endpoint|Objective Response Rate (ORR) by Baseline PD-L1 Expression for All Randomized Participants at Primary Endpoint,Bristol-Myers Squibb,All,"18 Years and older   (Adult, Older Adult)",Phase 3,792,Industry,Interventional,Allocation: Randomized|Intervention Model: Parallel Assignment|Masking: None (Open Label)|Primary Purpose: Treatment,CA209-057|2012-002472-14,10-Oct-12,5-Feb-15,23-Jan-20,28-Aug-12,26-Feb-16,19-Dec-18,"Mayo Clinic Arizona, Scottsdale, Arizona, United States|City Of Hope National Medical Center, Duarte, California, United States|City Of Hope, Duarte, California, United States|Sharp Clinical Oncology Research, San Diego, California, United States|San Francisco Oncology Associates, San Francisco, California, United States|Yale University, New Haven, Connecticut, United States|H. Lee Moffitt Cancer Center, Tampa, Florida, United States|Northwest Georgia Oncology Center, P.C., Marietta, Georgia, United States|University Of Chicago Medical Center, Chicago, Illinois, United States|Johns Hopkins Sidney Kimmel Comprehensive Cancer Center, Baltimore, Maryland, United States|The Johns Hopkins University, Baltimore, Maryland, United States|Dana Farber Cancer Institute, Boston, Massachusetts, United States|Dana-Farber Cancer Institute, Boston, Massachusetts, United States|Dartmouth-Hitchcock Medical Center, Lebanon, New Hampshire, United States|Winthrop University Hospital Oncology/Hematology, Mineola, New York, United States|Winthrop University Hospital, Mineola, New York, United States|Memorial Sloan Kettering Cancer Center, New York, New York, United States|Duke University Medical Center, Durham, North Carolina, United States|Oncology Hematology Care, Inc., Cincinnati, Ohio, United States|Oncology Hematology Care, Cincinnati, Ohio, United States|St. Mary Medical Center, Langhorne, Pennsylvania, United States|Fox Chase Cancer Center, Philadelphia, Pennsylvania, United States|Guthrie Clinic, Ltd, Sayre, Pennsylvania, United States|Guthrie Medical Group, P.C., Sayre, Pennsylvania, United States|South Carolina Oncology Associates, Columbia, South Carolina, United States|Tennessee Oncology, PLLC, Chattanooga, Tennessee, United States|Tennessee Oncology, PLLC, Nashville, Tennessee, United States|Henry-Joyce Cancer Center, Nashville, Tennessee, United States|University Of Texas Southwestern Medical Center, Dallas, Texas, United States|The University of Texas MD Anderson Cancer Center, Houston, Texas, United States|Univ Of Tx. Md Anderson, Houston, Texas, United States|Columbia Basin Hematology And Oncology, Kennewick, Washington, United States|Kadlec Clinical Hematology and Oncology, Kennewick, Washington, United States|Swedish Cancer Institute, Seattle, Washington, United States|Seattle Cancer Care Alliance, Seattle, Washington, United States|West Virginia University-Mbrcc, Morgantown, West Virginia, United States|West Virginia University-Mbrcc, Morgantown, West Virginia, United States|Local Institution, Capital Federal, Buenos Aires, Argentina|Local Institution, Capital Federal, Buenos Aires, Argentina|Local Institution, Ciudad De Buenos Aires, Buenos Aires, Argentina|Local Institution, Buenos Aires, Argentina|Local Institution, Buenos Aires, Argentina|Local Institution, La Rioja, Argentina|Local Institution, Tweed Heads, New South Wales, Australia|Local Institution, Woolloongabba, Queensland, Australia|Local Institution, Adelaide, South Australia, Australia|Local Institution, Kurralta Park, South Australia, Australia|Local Institution, Frankston, Victoria, Australia|Local Institution, Melbourne, Victoria, Australia|Local Institution, Linz, Austria|Local Institution, Salzburg, Austria|Local Institution, Vienna, Austria|Local Institution, Wels, Austria|Local Institution, Salvador, Bahia, Brazil|Local Institution, Salvador, Bahia, Brazil|Local Institution, Fortaleza, Ceara, Brazil|Local Institution, Fortaleza, Ceara, Brazil|Local Institution, Porto Alegre, RIO Grande DO SUL, Brazil|Local Institution, Porto Alegre, Rio Grande Do Sul, Brazil|Local Institution, Porto Alegre, RIO Grande DO SUL, Brazil|Local Institution, Porto Alegre, Rio Grande Do Sul, Brazil|Local Institution, Barretos, SAO Paulo, Brazil|Local Institution, Barretos, Sao Paulo, Brazil|Local Institution, Rio De Janeiro, Brazil|Local Institution, Rio De Janeiro, Brazil|Cross Cancer Institute, Edmonton, Alberta, Canada|Local Institution, London, Ontario, Canada|Centre De Sante Et De Services Sociaux Rimouski Neigette, Rimouski, Quebec, Canada|CISSS du Bas-Saint-Laurent Hopital Regional de Rimouski, Rimouski, Quebec, Canada|Local Institution, Santiago, Metropolitana, Chile|Local Institution, Santiago, Metropolitana, Chile|Local Institution, Recoleta, Santiago DE Chile, Chile|Local Institution, Vi?a Del Mar, Valparaiso, Chile|Local Institution, Praha 8, Czechia|Local Institution, Creteil, France|Local Institution, Dijon Cedex, France|Local Institution, La Roche Sur Yon Cedex 9, France|Local Institution, Lyon Cedex 08, France|Local Institution, Marseille Cedex 20, France|Local Institution, Poitiers, France|Local Institution, Rennes Cedex 9, France|Local Institution, Toulouse, France|Local Institution, Bad Berka, Germany|Local Institution, Gerlingen, Germany|Local Institution, Grosshansdorf, Germany|Local Institution, Heidelberg, Germany|Local Institution, Koeln, Germany|Local Institution, Mainz, Germany|Local Institution, Recklinghausen, Germany|Local Institution, Ulm, Germany|Local Institution, Hong Kong, Hong Kong|Local Institution, Budapest, Hungary|Local Institution, Bergamo, Italy|Local Institution, Bologna, Italy|Local Institution, Meldola (fc), Italy|Local Institution, Milano, Italy|Local Institution, Padova, Italy|Local Institution, Parma, Italy|Local Institution, Perugia, Italy|Local Institution, Ravenna, Italy|Local Institution, Siena, Italy|Local Institution, Mexico City, Distrito Federal, Mexico|Local Institution, Mexico, Distrito Federal, Mexico|Local Institution, Mexico, Distrito Federal, Mexico|Local Institution, Monterrey, Nuevo LEON, Mexico|Local Institution, Hermosillo, Sonora, Mexico|Local Institution, Oslo, Norway|Local Institution, Miraflores, Lima, Peru|Local Institution, Arequipa, Peru|Local Institution, Lima, Peru|Local Institution, Lima, Peru|Local Institution, Gdansk, Poland|Local Institution, Krakow, Poland|Local Institution, Olsztyn, Poland|Local Institution, Szczecin, Poland|Local Institution, Warszawa, Poland|Local Institution, Bucuresti, Romania|Local Institution, Cluj-Napoca, Romania|Local Institution, Craiova, Romania|Local Institution, Iasi, Romania|Local Institution, Timisoara, Romania|Local Institution, Moscow, Russian Federation|Local Institution, Moscow, Russian Federation|Local Institution, St. Petersburg, Russian Federation|Local Institution, Singapore, Singapore|Local Institution, Singapore, Singapore|Local Institution, Barcelona, Spain|Local Institution, Madrid, Spain|Local Institution, Madrid, Spain|Local Institution, Sevilla, Spain|Local Institution, Vizcaya, Spain|Local Institution, Chur, Graubuenden, Switzerland|Local Institution, Basel, Switzerland|Local Institution, Chur, Switzerland",,https://ClinicalTrials.gov/show/NCT01673867,2,nivolumab,docetaxel,1,1,FALSE,FALSE,FALSE,FALSE,nivolumab,docetaxel,1,1,TRUE,
462,2020,2021,NCT01783834,Gefitinib Versus Pemetrexed for Previously Treated NSCLC Patients,,Completed,No Results Available,Previous Treated Metastatic Non-small Cell Lung Cancer,Drug: Gefitinib|Drug: Pemetrexed,Overall response rate|Progression free survival,Gachon University Gil Medical Center,All,"18 Years and older   (Adult, Older Adult)",Phase 2,95,Other,Interventional,Allocation: Randomized|Intervention Model: Parallel Assignment|Masking: None (Open Label)|Primary Purpose: Treatment,2008-GIRBA-1739,8-Feb,14-Jun,14-Jun,5-Feb-13,,11-Feb-16,"Gachon university Gil Medical Center, Incheon, Korea, Republic of",,https://ClinicalTrials.gov/show/NCT01783834,2,gefitinib,pemetrexed,1,1,FALSE,FALSE,FALSE,FALSE,gefitinib,pemetrexed,1,1,TRUE,
478,2110,2111,NCT00003562,Docetaxel Plus Carboplatin in Treating Patients With Stage IIIB or Stage IV Non-small Cell Lung Cancer,,Unknown status,No Results Available,Lung Cancer,Drug: carboplatin|Drug: docetaxel,,"Hope Cancer Institute, Inc.|National Cancer Institute (NCI)",All,"18 Years and older   (Adult, Older Adult)",Phase 2,38,Industry,Interventional,Primary Purpose: Treatment,CDR0000066626|HCRN-007|NCI-V98-1469,Jul-98,,,21-May-04,,4-Dec-13,"Bethany Medical Center, Kansas City, Kansas, United States|Heartland Cancer Research Network, Kansas City, Kansas, United States",,https://ClinicalTrials.gov/show/NCT00003562,2,carboplatin,docetaxel,1,1,FALSE,FALSE,FALSE,FALSE,carboplatin,docetaxel,1,1,TRUE,
487,2138,2139,NCT00406276,Phase I/II Trial of RAD001 Plus Docetaxel in Patients With Metastatic or Recurrent Non-Small Cell Lung Cancer,,Terminated,Has Results,Lung Cancer,Drug: RAD001|Drug: Docetaxel,"Number of Subjects Showing Partial Response and Stable Disease With the Combination of RAD001 and Docetaxel.|Time to Progression:Time Period (in Months) From Study Entry Until Disease Progression, Death, or Last Date of Contact.",Emory University,All,"18 Years and older   (Adult, Older Adult)",Phase 1|Phase 2,28,Other,Interventional,Intervention Model: Single Group Assignment|Masking: None (Open Label)|Primary Purpose: Treatment,1342-2004,6-Nov,10-Dec,13-Feb,4-Dec-06,28-May-12,23-Aug-13,"Emory University Winship Cancer Institute, Atlanta, Georgia, United States",,https://ClinicalTrials.gov/show/NCT00406276,2,rad001,docetaxel,1,1,FALSE,FALSE,FALSE,FALSE,afinitor,docetaxel,1,1,TRUE,
501,2196,2197,NCT02590003,Single Agent Versus Combination Chemotherapy to Treat High-risk Elderly With Non-small Cell Lung Cancer,,Terminated,Has Results,"Carcinoma, Non-small Cell Lung",Drug: Carboplatin|Drug: Nab-paclitaxel,Treatment Failure-free Survival|Overall Response Rate|Progression-free Survival|Overall Survival|Grade 3-5 Adverse Events|Symptom Assessment (Measured by FACT-L Symptom Assessment Scale),Yale University,All,71 Years and older   (Older Adult),Phase 2,3,Other,Interventional,Allocation: Randomized|Intervention Model: Parallel Assignment|Masking: None (Open Label)|Primary Purpose: Treatment,1403013529,15-Nov,16-Sep,16-Sep,28-Oct-15,28-Feb-18,28-Feb-18,"Yale Cancer Center, New Haven, Connecticut, United States",,https://ClinicalTrials.gov/show/NCT02590003,2,carboplatin,nab-paclitaxel,1,1,FALSE,FALSE,FALSE,FALSE,carboplatin,nab-paclitaxel,1,1,TRUE,
503,2206,2207,NCT02574598,MK-3475 in Combination With Docetaxel vs Docetaxel Alone in Non-Small Cell Lung Cancer Patients,,Enrolling by invitation,No Results Available,"Carcinoma, Non-Small-Cell Lung",Drug: MK-3475|Drug: Docetaxel,Overall Response rate,Instituto Nacional de Cancerologia de Mexico,All,"18 Years to 90 Years   (Adult, Older Adult)",Phase 2,70,Other,Interventional,Allocation: Randomized|Intervention Model: Crossover Assignment|Masking: None (Open Label)|Primary Purpose: Treatment,INCAN/014/033/ICI,16-Jun,19-Oct,20-Oct,14-Oct-15,,21-Dec-18,"National Cancer Institute of Mexico, Mexico city, Distrito Federal, Mexico",,https://ClinicalTrials.gov/show/NCT02574598,2,mk-3475,docetaxel,1,1,FALSE,FALSE,FALSE,FALSE,pembrolizumab,docetaxel,1,1,TRUE,
504,2210,2211,NCT02864394,Study of Pembrolizumab Versus Docetaxel in Participants Previously Treated for Non-Small Cell Lung Cancer (MK-3475-033),,"Active, not recruiting",No Results Available,"Carcinoma, Non-Small-Cell Lung",Biological: pembrolizumab 2 mg/kg|Drug: Docetaxel 75 mg/m^2,OS in Participants with Tumors that are Positive for PD-L1 Expression (Tumor Proportion Score 1 to 49%)|OS in Participants with Tumors that are Positive for PD-L1 Expression (Tumor Proportion Score ≥50%)|PFS per Response Evaluation Criteria in Solid Tumors Version 1.1 (RECIST 1.1) as Assessed by Blinded Independent Central Review (BICR) in Participants with Tumors that are Positive for PD-L1 Expression (Tumor Proportion Score 1 to 49%)|PFS per RECIST 1.1 as Assessed by BICR in Participants with Tumors that are Positive for PD-L1 Expression (Tumor Proportion Score ≥50%)|Duration of Response (DOR) per RECIST 1.1 as Assessed by BICR in Participants with Tumors that are Positive for PD-L1 Expression (Tumor Proportion Score 1 to 49%)|DOR per RECIST 1.1 as Assessed by BICR in Participants with Tumors that are Positive for PD-L1 Expression (Tumor Proportion Score ≥50%)|Objective Response Rate (ORR) per RECIST 1.1 as Assessed by BICR in Participants with Tumors that are Positive for PD-L1 Expression (Tumor Proportion Score 1 to 49%)|ORR per RECIST 1.1 as Assessed by BICR in Participants with Tumors that are Positive for PD-L1 Expression (Tumor Proportion Score ≥50%)|Number of Participants Who Experience an Adverse Event (AE)|Number of Participants Who Discontinue Study Drug Due to an AE,Merck Sharp & Dohme Corp.,All,"18 Years and older   (Adult, Older Adult)",Phase 3,425,Industry,Interventional,Allocation: Randomized|Intervention Model: Parallel Assignment|Masking: None (Open Label)|Primary Purpose: Treatment,3475-033|MK-3475-033,7-Sep-16,9-Sep-19,14-Oct-20,12-Aug-16,,20-Sep-19,,,https://ClinicalTrials.gov/show/NCT02864394,2,pembrolizumab 2 mg/kg,docetaxel 75 mg/m^2,1,1,FALSE,FALSE,FALSE,FALSE,pembrolizumab,docetaxel,1,1,TRUE,
